{
  "$schema": "https://json-schema.org/draft/2020-12/schema",
  "$id": "https://phoenixgott.github.io/analyse-paris-buts/schema/modele.schema.json",
  "title": "Calculs du modèle pour un match — Analyse Paris Buts",
  "description": "Sortie de modele/analyser.js (« CALCULS DU SITE » du prompt IA). Probabilités de 0 à 1. null = N/D.",
  "type": "object",
  "additionalProperties": false,
  "required": [
    "schema_version", "match_id", "demo", "calcule_le", "calculable", "fiable", "reglages", "methode", "buts_attendus",
    "ajustements", "grille", "scores_probables", "total_buts", "mi_temps", "buteurs", "marches", "confiance", "verdict", "unites", "avertissement"
  ],
  "properties": {
    "schema_version": { "type": "string", "enum": ["1.1.0"], "description": "1.1.0 : ajout de « unites »." },
    "unites": { "type": "string" },
    "match_id": { "type": "string" },
    "demo": { "type": "boolean" },
    "calcule_le": { "type": "string", "pattern": "^\\d{4}-\\d{2}-\\d{2}T\\d{2}:\\d{2}:\\d{2}Z$" },
    "calculable": { "type": "boolean" },
    "fiable": { "type": "boolean" },
    "reglages": { "type": "object" },
    "methode": {
      "type": ["object", "null"],
      "additionalProperties": false,
      "required": ["date_reference", "historique", "domicile", "exterieur", "avantage_domicile", "moyenne_buts_equipe", "rho", "iterations"],
      "properties": {
        "date_reference": { "type": "string" },
        "historique": {
          "type": "object",
          "additionalProperties": false,
          "required": ["matchs_ligue", "matchs_forme", "matchs_utilises"],
          "properties": {
            "matchs_ligue": { "type": "integer", "minimum": 0 },
            "matchs_forme": { "type": "integer", "minimum": 0 },
            "matchs_utilises": { "type": "integer", "minimum": 1 }
          }
        },
        "domicile": { "$ref": "#/$defs/force" },
        "exterieur": { "$ref": "#/$defs/force" },
        "avantage_domicile": { "type": "number", "minimum": 0 },
        "moyenne_buts_equipe": { "type": "number", "minimum": 0 },
        "rho": { "type": "number", "minimum": -1, "maximum": 1 },
        "iterations": { "type": "integer", "minimum": 1 }
      }
    },
    "buts_attendus": {
      "type": ["object", "null"],
      "additionalProperties": false,
      "required": ["domicile", "exterieur", "total", "domicile_avant_ajustements", "exterieur_avant_ajustements"],
      "properties": {
        "domicile": { "type": "number", "minimum": 0 },
        "exterieur": { "type": "number", "minimum": 0 },
        "total": { "type": "number", "minimum": 0 },
        "domicile_avant_ajustements": { "type": "number", "minimum": 0 },
        "exterieur_avant_ajustements": { "type": "number", "minimum": 0 }
      }
    },
    "ajustements": {
      "type": ["object", "null"],
      "additionalProperties": false,
      "required": ["liste", "brut", "total"],
      "properties": {
        "liste": {
          "type": "array",
          "items": {
            "type": "object",
            "additionalProperties": false,
            "required": ["type", "equipe", "effet", "statut", "raison"],
            "properties": {
              "type": { "type": "string" },
              "equipe": { "type": "string", "enum": ["D", "E", "DE"] },
              "effet": { "type": "number", "minimum": -0.2, "maximum": 0.2 },
              "statut": { "type": "string", "enum": ["appliqué", "aucun", "N/D", "non évalué"] },
              "raison": { "type": "string" }
            }
          }
        },
        "brut": { "$ref": "#/$defs/par_equipe" },
        "total": { "$ref": "#/$defs/par_equipe_borne" }
      }
    },
    "grille": {
      "type": ["array", "null"],
      "items": { "type": "array", "items": { "$ref": "#/$defs/proba" } }
    },
    "scores_probables": {
      "type": "array",
      "items": {
        "type": "object",
        "additionalProperties": false,
        "required": ["score", "proba"],
        "properties": { "score": { "type": "string", "pattern": "^\\d{1,2}-\\d{1,2}$" }, "proba": { "$ref": "#/$defs/proba" } }
      }
    },
    "total_buts": {
      "type": ["object", "null"],
      "additionalProperties": false,
      "required": [
        "over_0_5", "over_1_5", "over_2_5", "over_3_5", "over_4_5", "over_5_5",
        "under_0_5", "under_1_5", "under_2_5", "under_3_5", "under_4_5", "under_5_5"
      ],
      "properties": {
        "over_0_5": { "$ref": "#/$defs/proba" },
        "over_1_5": { "$ref": "#/$defs/proba" },
        "over_2_5": { "$ref": "#/$defs/proba" },
        "over_3_5": { "$ref": "#/$defs/proba" },
        "over_4_5": { "$ref": "#/$defs/proba" },
        "over_5_5": { "$ref": "#/$defs/proba" },
        "under_0_5": { "$ref": "#/$defs/proba" },
        "under_1_5": { "$ref": "#/$defs/proba" },
        "under_2_5": { "$ref": "#/$defs/proba" },
        "under_3_5": { "$ref": "#/$defs/proba" },
        "under_4_5": { "$ref": "#/$defs/proba" },
        "under_5_5": { "$ref": "#/$defs/proba" }
      }
    },
    "mi_temps": {
      "type": ["object", "null"],
      "additionalProperties": false,
      "required": ["part_buts_mt", "source", "buts_attendus", "over_0_5", "under_0_5", "over_1_5", "under_1_5"],
      "properties": {
        "part_buts_mt": { "$ref": "#/$defs/proba" },
        "source": { "type": "string", "enum": ["historique", "stats des équipes", "forme des équipes"] },
        "buts_attendus": { "type": "object" },
        "over_0_5": { "$ref": "#/$defs/proba" },
        "under_0_5": { "$ref": "#/$defs/proba" },
        "over_1_5": { "$ref": "#/$defs/proba" },
        "under_1_5": { "$ref": "#/$defs/proba" }
      }
    },
    "buteurs": {
      "type": "array",
      "items": {
        "type": "object",
        "additionalProperties": false,
        "required": ["nom", "equipe", "taux_90", "minutes_prevues", "tireur_penalty", "part", "lambda", "proba", "statut"],
        "properties": {
          "nom": { "type": "string" },
          "equipe": { "type": "string", "enum": ["D", "E"] },
          "taux_90": { "type": ["number", "null"], "minimum": 0 },
          "minutes_prevues": { "type": ["integer", "null"] },
          "tireur_penalty": { "type": ["boolean", "null"] },
          "part": { "type": ["number", "null"], "minimum": 0, "maximum": 1 },
          "lambda": { "type": ["number", "null"], "minimum": 0 },
          "proba": { "$ref": "#/$defs/proba" },
          "statut": { "type": "string" }
        }
      }
    },
    "marches": {
      "type": "array",
      "items": {
        "type": "object",
        "additionalProperties": false,
        "required": ["marche", "libelle", "groupe", "proba", "cote", "bookmaker", "value", "kelly", "mise_pct", "cote_min", "suggere", "raison"],
        "properties": {
          "marche": { "type": "string" },
          "libelle": { "type": "string" },
          "groupe": { "type": "string", "enum": ["total", "mi_temps", "buteur"] },
          "proba": { "$ref": "#/$defs/proba" },
          "cote": { "type": ["number", "null"], "minimum": 1 },
          "bookmaker": { "type": ["string", "null"] },
          "value": { "type": ["number", "null"] },
          "kelly": { "type": ["number", "null"] },
          "mise_pct": { "type": "number", "minimum": 0, "maximum": 0.02 },
          "cote_min": { "type": ["number", "null"], "minimum": 1 },
          "suggere": { "type": "boolean" },
          "raison": { "type": "string" }
        }
      }
    },
    "confiance": {
      "type": "object",
      "additionalProperties": false,
      "required": ["indice", "composantes"],
      "properties": {
        "indice": { "type": ["integer", "null"], "minimum": 0, "maximum": 100 },
        "composantes": {
          "type": "object",
          "additionalProperties": false,
          "required": ["qualite", "echantillon", "accord"],
          "properties": {
            "qualite": { "type": ["number", "null"], "minimum": 0, "maximum": 100 },
            "echantillon": { "type": ["number", "null"], "minimum": 0, "maximum": 100 },
            "accord": { "type": ["number", "null"], "minimum": 0, "maximum": 100 }
          }
        }
      }
    },
    "verdict": {
      "type": "object",
      "additionalProperties": false,
      "required": ["decision", "marche", "libelle", "proba", "cote", "cote_min", "value", "mise_pct", "raison"],
      "properties": {
        "decision": { "type": "string", "enum": ["PARIER", "PASSER"] },
        "marche": { "type": ["string", "null"] },
        "libelle": { "type": ["string", "null"] },
        "proba": { "$ref": "#/$defs/proba" },
        "cote": { "type": ["number", "null"] },
        "cote_min": { "type": ["number", "null"] },
        "value": { "type": ["number", "null"] },
        "mise_pct": { "type": "number", "minimum": 0, "maximum": 0.02 },
        "raison": { "type": "string" }
      }
    },
    "avertissement": { "type": "string" }
  },
  "$defs": {
    "proba": { "type": ["number", "null"], "minimum": 0, "maximum": 1 },
    "force": {
      "type": "object",
      "additionalProperties": false,
      "required": ["n_matchs", "facteur_shrinkage", "attaque", "defense"],
      "properties": {
        "n_matchs": { "type": "integer", "minimum": 0 },
        "facteur_shrinkage": { "type": "number", "minimum": 0, "maximum": 1 },
        "attaque": { "type": "number" },
        "defense": { "type": "number" }
      }
    },
    "par_equipe": {
      "type": "object",
      "additionalProperties": false,
      "required": ["D", "E"],
      "properties": { "D": { "type": "number" }, "E": { "type": "number" } }
    },
    "par_equipe_borne": {
      "type": "object",
      "additionalProperties": false,
      "required": ["D", "E"],
      "properties": { "D": { "type": "number", "minimum": -0.1, "maximum": 0.1 }, "E": { "type": "number", "minimum": -0.1, "maximum": 0.1 } }
    }
  }
}
