{
  "schema_version": "1.1.0",
  "match_id": "demo-d1f-montaval-clairefont",
  "demo": true,
  "calcule_le": "2026-09-28T05:30:00Z",
  "calculable": true,
  "fiable": true,
  "reglages": {
    "demi_vie_jours": 60,
    "seuil_shrinkage": 8,
    "buts_max": 10,
    "plafond_ajustements": 0.1,
    "seuil_value": 0.05,
    "value_suspecte": 0.3,
    "proba_min": 0.2,
    "fraction_kelly": 0.25,
    "mise_max": 0.02,
    "confiance_min": 50
  },
  "methode": {
    "date_reference": "2026-09-28",
    "historique": {
      "matchs_ligue": 288,
      "matchs_forme": 0,
      "matchs_utilises": 288
    },
    "domicile": {
      "n_matchs": 48,
      "facteur_shrinkage": 1,
      "attaque": 0.618,
      "defense": -0.354
    },
    "exterieur": {
      "n_matchs": 48,
      "facteur_shrinkage": 1,
      "attaque": 0.526,
      "defense": -0.012
    },
    "avantage_domicile": 1.551,
    "moyenne_buts_equipe": 0.784,
    "rho": -0.0812,
    "iterations": 40
  },
  "buts_attendus": {
    "domicile": 2.195,
    "exterieur": 0.91,
    "total": 3.105,
    "domicile_avant_ajustements": 2.229,
    "exterieur_avant_ajustements": 0.931
  },
  "ajustements": {
    "liste": [
      {
        "type": "repos",
        "equipe": "D",
        "effet": 0,
        "statut": "aucun",
        "raison": "Stade Montaval : 9 jours de repos"
      },
      {
        "type": "repos",
        "equipe": "E",
        "effet": 0,
        "statut": "aucun",
        "raison": "AS Clairefont : 9 jours de repos"
      },
      {
        "type": "voyage",
        "equipe": "DE",
        "effet": 0,
        "statut": "N/D",
        "raison": "Distance de déplacement non fournie par les sources"
      },
      {
        "type": "derby",
        "equipe": "DE",
        "effet": 0,
        "statut": "aucun",
        "raison": "Pas de derby signalé"
      },
      {
        "type": "enjeu",
        "equipe": "DE",
        "effet": 0,
        "statut": "non évalué",
        "raison": "Texte libre : non traduit en effet chiffré (à lire dans la fiche)"
      },
      {
        "type": "arbitre",
        "equipe": "DE",
        "effet": 0,
        "statut": "N/D",
        "raison": "Penaltys sifflés par l’arbitre inconnus"
      },
      {
        "type": "pluie",
        "equipe": "DE",
        "effet": 0,
        "statut": "N/D",
        "raison": "Pluie inconnue"
      },
      {
        "type": "vent",
        "equipe": "DE",
        "effet": 0,
        "statut": "N/D",
        "raison": "Vent inconnu"
      },
      {
        "type": "absents",
        "equipe": "D",
        "effet": -0.015,
        "statut": "appliqué",
        "raison": "Stade Montaval : 1 absent(s) (−1,5 % chacun, max −6 %)"
      },
      {
        "type": "absents",
        "equipe": "E",
        "effet": -0.0225,
        "statut": "appliqué",
        "raison": "AS Clairefont : 1,5 absent(s) (−1,5 % chacun, max −6 %)"
      }
    ],
    "brut": {
      "D": -0.015,
      "E": -0.0225
    },
    "total": {
      "D": -0.015,
      "E": -0.0225
    }
  },
  "grille": [
    [
      0.052081,
      0.033514,
      0.018563,
      0.005632,
      0.001282,
      0.000233,
      0.000035,
      0.000005,
      0.000001,
      0,
      0
    ],
    [
      0.091088,
      0.096805,
      0.040748,
      0.012364,
      0.002814,
      0.000512,
      0.000078,
      0.00001,
      0.000001,
      0,
      0
    ],
    [
      0.107957,
      0.098268,
      0.044724,
      0.01357,
      0.003088,
      0.000562,
      0.000085,
      0.000011,
      0.000001,
      0,
      0
    ],
    [
      0.078993,
      0.071903,
      0.032725,
      0.009929,
      0.00226,
      0.000411,
      0.000062,
      0.000008,
      0.000001,
      0,
      0
    ],
    [
      0.04335,
      0.039459,
      0.017959,
      0.005449,
      0.00124,
      0.000226,
      0.000034,
      0.000004,
      0.000001,
      0,
      0
    ],
    [
      0.019032,
      0.017324,
      0.007884,
      0.002392,
      0.000544,
      0.000099,
      0.000015,
      0.000002,
      0,
      0,
      0
    ],
    [
      0.006963,
      0.006338,
      0.002885,
      0.000875,
      0.000199,
      0.000036,
      0.000006,
      0.000001,
      0,
      0,
      0
    ],
    [
      0.002183,
      0.001988,
      0.000905,
      0.000274,
      0.000062,
      0.000011,
      0.000002,
      0,
      0,
      0,
      0
    ],
    [
      0.000599,
      0.000545,
      0.000248,
      0.000075,
      0.000017,
      0.000003,
      0,
      0,
      0,
      0,
      0
    ],
    [
      0.000146,
      0.000133,
      0.000061,
      0.000018,
      0.000004,
      0.000001,
      0,
      0,
      0,
      0,
      0
    ],
    [
      0.000032,
      0.000029,
      0.000013,
      0.000004,
      0.000001,
      0,
      0,
      0,
      0,
      0,
      0
    ]
  ],
  "scores_probables": [
    {
      "score": "2-0",
      "proba": 0.108
    },
    {
      "score": "2-1",
      "proba": 0.0983
    },
    {
      "score": "1-1",
      "proba": 0.0968
    },
    {
      "score": "1-0",
      "proba": 0.0911
    },
    {
      "score": "3-0",
      "proba": 0.079
    }
  ],
  "total_buts": {
    "over_0_5": 0.9479,
    "over_1_5": 0.8233,
    "over_2_5": 0.6,
    "over_3_5": 0.3764,
    "over_4_5": 0.2027,
    "over_5_5": 0.0949,
    "under_0_5": 0.0521,
    "under_1_5": 0.1767,
    "under_2_5": 0.4,
    "under_3_5": 0.6236,
    "under_4_5": 0.7973,
    "under_5_5": 0.9051
  },
  "mi_temps": {
    "part_buts_mt": 0.4948,
    "source": "historique",
    "buts_attendus": {
      "domicile": 1.086,
      "exterieur": 0.45
    },
    "over_0_5": 0.7764,
    "over_1_5": 0.4629,
    "under_0_5": 0.2236,
    "under_1_5": 0.5371
  },
  "buteurs": [
    {
      "nom": "D. Renard",
      "equipe": "D",
      "taux_90": 0.455,
      "minutes_prevues": null,
      "tireur_penalty": true,
      "part": null,
      "lambda": null,
      "proba": null,
      "statut": "N/D : minutes prévues"
    },
    {
      "nom": "J. Vidal",
      "equipe": "D",
      "taux_90": 0.309,
      "minutes_prevues": null,
      "tireur_penalty": false,
      "part": null,
      "lambda": null,
      "proba": null,
      "statut": "N/D : minutes prévues"
    },
    {
      "nom": "D. Hoarau",
      "equipe": "D",
      "taux_90": 0.136,
      "minutes_prevues": null,
      "tireur_penalty": false,
      "part": null,
      "lambda": null,
      "proba": null,
      "statut": "N/D : minutes prévues"
    },
    {
      "nom": "E. Marchetti",
      "equipe": "E",
      "taux_90": 0.452,
      "minutes_prevues": null,
      "tireur_penalty": true,
      "part": null,
      "lambda": null,
      "proba": null,
      "statut": "N/D : minutes prévues"
    },
    {
      "nom": "S. Renard",
      "equipe": "E",
      "taux_90": 0.303,
      "minutes_prevues": null,
      "tireur_penalty": false,
      "part": null,
      "lambda": null,
      "proba": null,
      "statut": "N/D : minutes prévues"
    },
    {
      "nom": "E. Strand",
      "equipe": "E",
      "taux_90": 0.195,
      "minutes_prevues": null,
      "tireur_penalty": false,
      "part": null,
      "lambda": null,
      "proba": null,
      "statut": "N/D : minutes prévues"
    }
  ],
  "marches": [
    {
      "marche": "over_0_5",
      "libelle": "Plus de 0,5 but",
      "groupe": "total",
      "proba": 0.9479,
      "cote": 1.05,
      "bookmaker": "Book C",
      "value": -0.0047,
      "kelly": -0.0937,
      "mise_pct": 0,
      "cote_min": 1.11,
      "suggere": false,
      "raison": "Value négative (seuil 5 %)"
    },
    {
      "marche": "under_0_5",
      "libelle": "Moins de 0,5 but",
      "groupe": "total",
      "proba": 0.0521,
      "cote": 12.33,
      "bookmaker": "Book A",
      "value": -0.3578,
      "kelly": -0.0316,
      "mise_pct": 0,
      "cote_min": 20.16,
      "suggere": false,
      "raison": "Value négative (seuil 5 %)"
    },
    {
      "marche": "over_1_5",
      "libelle": "Plus de 1,5 but",
      "groupe": "total",
      "proba": 0.8233,
      "cote": 1.34,
      "bookmaker": "Book A",
      "value": 0.1032,
      "kelly": 0.3037,
      "mise_pct": 0.02,
      "cote_min": 1.28,
      "suggere": true,
      "raison": "Value au-dessus du seuil"
    },
    {
      "marche": "under_1_5",
      "libelle": "Moins de 1,5 but",
      "groupe": "total",
      "proba": 0.1767,
      "cote": 3.48,
      "bookmaker": "Book A",
      "value": -0.3851,
      "kelly": -0.1553,
      "mise_pct": 0,
      "cote_min": 5.94,
      "suggere": false,
      "raison": "Value négative (seuil 5 %)"
    },
    {
      "marche": "over_2_5",
      "libelle": "Plus de 2,5 buts",
      "groupe": "total",
      "proba": 0.6,
      "cote": 2.06,
      "bookmaker": "Book C",
      "value": 0.236,
      "kelly": 0.2226,
      "mise_pct": 0.02,
      "cote_min": 1.75,
      "suggere": true,
      "raison": "Value au-dessus du seuil"
    },
    {
      "marche": "under_2_5",
      "libelle": "Moins de 2,5 buts",
      "groupe": "total",
      "proba": 0.4,
      "cote": 1.82,
      "bookmaker": "Book C",
      "value": -0.272,
      "kelly": -0.3317,
      "mise_pct": 0,
      "cote_min": 2.62,
      "suggere": false,
      "raison": "Value négative (seuil 5 %)"
    },
    {
      "marche": "over_3_5",
      "libelle": "Plus de 3,5 buts",
      "groupe": "total",
      "proba": 0.3764,
      "cote": 3.83,
      "bookmaker": "Book A",
      "value": 0.4414,
      "kelly": 0.156,
      "mise_pct": 0,
      "cote_min": 2.79,
      "suggere": false,
      "raison": "Value suspecte (> 30 %) : écart trop grand avec le marché, erreur de modèle probable"
    },
    {
      "marche": "under_3_5",
      "libelle": "Moins de 3,5 buts",
      "groupe": "total",
      "proba": 0.6236,
      "cote": 1.29,
      "bookmaker": "Book B",
      "value": -0.1955,
      "kelly": -0.6741,
      "mise_pct": 0,
      "cote_min": 1.68,
      "suggere": false,